incident_number,incident_id,title,summary,details,status,service,created_at,updated_at
227,Q08UJZTDMUR2LF,Sustainable Packaging Supplier Partnership,[#227] Sustainable Packaging Supplier Partnership,Eco-Vibe Cleaners Teams Up with Suppliers Committed to Environmental Responsibility,resolved,EcoVibe Cleaners,2024-03-08T06:04:02Z,2024-03-08T06:04:10Z,
228,Q2UPG1INLMS61S,Customer Loyalty Rewards,[#228] Customer Loyalty Rewards,"The payment processing service launched a loyalty program, offering exclusive discounts, cashback, and perks for users who frequently utilized their platform.",triggered,Payment Processing System,2024-03-08T06:04:32Z,2024-03-08T06:04:32Z,
229,Q24JEUN4NGMJNS,Carbon Offset Program Implementation,[#229] Carbon Offset Program Implementation,"Eco-Vibe Cleaners Offsets Carbon Emissions Through Renewable Energy Projects""",resolved,EcoVibe Cleaners,2024-03-08T06:04:35Z,2024-03-08T06:04:42Z,
230,Q2VYVLGCTRU82S,Waste-to-Energy Conversion Initiative,[#230] Waste-to-Energy Conversion Initiative,: Eco-Vibe Cleaners Converts Waste Materials into Renewable Energy Sources,resolved,EcoVibe Cleaners,2024-03-08T06:05:04Z,2024-03-08T06:05:11Z,
231,Q1T6DI6OMLSVGD,Green Marketing Campaign,[#231] Green Marketing Campaign,Eco-Vibe Cleaners Promotes Eco-Friendly Products and Practices Through Marketing Initiatives,resolved,EcoVibe Cleaners,2024-03-08T06:05:33Z,2024-03-08T06:05:39Z,
232,Q3WBGXBQBU0VBR,Holiday Shopping Bonanza,[#232] Holiday Shopping Bonanza,"During a major shopping season, the payment processing service experienced record transaction volumes, showcasing its ability to handle high-demand periods seamlessly and efficiently.",triggered,Payment Processing System,2024-03-08T06:05:39Z,2024-03-08T06:05:39Z,
233,Q2UQEZEISU7MYF,Eco-Friendly Transportation Fleet Expansion,[#233] Eco-Friendly Transportation Fleet Expansion,Eco-Vibe Cleaners Adds Electric Vehicles to Delivery Fleet,resolved,EcoVibe Cleaners,2024-03-08T06:06:04Z,2024-03-08T06:06:13Z,
234,Q3ZQCD2K27ZM2X,Sustainability Report Publication,[#234] Sustainability Report Publication,Eco-Vibe Cleaners Releases Annual Report Highlighting Environmental Performance,resolved,EcoVibe Cleaners,2024-03-08T06:06:34Z,2024-03-08T06:06:42Z,
235,Q2BR7JZ91BDGW3,Eco-Tourism Destination Development,[#235] Eco-Tourism Destination Development,Eco-Vibe Cleaners Supports Development of Sustainable Tourism Sites,resolved,EcoVibe Cleaners,2024-03-08T06:07:07Z,2024-03-08T06:07:21Z,
236,Q11VZKM7BI04UZ,Water Conservation Awareness Program,[#236] Water Conservation Awareness Program, Eco-Vibe Cleaners Educates Communities on Water-Saving Techniques,resolved,EcoVibe Cleaners,2024-03-08T06:07:48Z,2024-03-08T06:07:56Z,
237,Q1W41JM693Q54S,Smartwatch Payment Glitch,[#237] Smartwatch Payment Glitch,"A temporary glitch in the payment processing service caused users' smartwatches to deduct incorrect amounts, but the issue was swiftly identified and resolved, highlighting the service's commitment to quick problem resolution.",triggered,Payment Processing System,2024-03-08T06:08:06Z,2024-03-08T07:08:06Z,
238,Q0JA28QJ1AYCG7,Carbon Neutrality Commitment,[#238] Carbon Neutrality Commitment, Eco-Vibe Cleaners Pledges to Achieve Carbon Neutrality by 2030,resolved,EcoVibe Cleaners,2024-03-08T06:08:19Z,2024-03-08T06:08:26Z,
239,Q35ULAFT15ZFIH,Eco-Friendly Event Sponsorship,[#239] Eco-Friendly Event Sponsorship,Eco-Vibe Cleaners Sponsors Sustainable Events to Minimize Environmental Impact,resolved,EcoVibe Cleaners,2024-03-08T06:08:52Z,2024-03-08T06:08:59Z,
240,Q2FNT6X1WQ75AR,Eco-Innovation Incubator,[#240] Eco-Innovation Incubator, Eco-Vibe Cleaners Launches Program to Support Startups Developing Green Solutions,resolved,EcoVibe Cleaners,2024-03-08T06:09:26Z,2024-03-08T06:09:35Z,
241,Q3QUP5EEIJBPZE,Subscription Management Feature,[#241] Subscription Management Feature,"The payment processing service introduced a subscription management feature, allowing users to effortlessly track and manage their recurring payments, reducing instances of accidental overdrafts.",triggered,Payment Processing System,2024-03-08T06:09:34Z,2024-03-08T06:09:34Z,
242,Q0V0P3YK41RUEL,Community Reforestation Initiative,[#242] Community Reforestation Initiative,Eco-Vibe Cleaners Leads Efforts to Plant Trees and Restore Forest Ecosystems,resolved,EcoVibe Cleaners,2024-03-08T06:10:01Z,2024-03-08T06:10:10Z,
243,Q09OH2O39ZQXRG,Sustainable Development Goals Alignment,[#243] Sustainable Development Goals Alignment,Eco-Vibe Cleaners Aligns Business Practices with UN SDGs for Positive Impact,resolved,EcoVibe Cleaners,2024-03-08T06:10:40Z,2024-03-08T06:10:52Z,
244,Q14GTHPQROD95F,User Empowerment Campaign,[#244] User Empowerment Campaign,"The service launched a campaign to empower users with financial literacy, offering webinars and educational resources on smart spending, budgeting, and understanding transaction fees.",triggered,Payment Processing System,2024-03-08T06:11:32Z,2024-03-08T06:11:32Z,
245,Q0YUADX8EJH57K,Real-time Currency Conversion,[#245] Real-time Currency Conversion,"Users traveling internationally praised the payment processing service for its real-time currency conversion feature, providing transparent and competitive exchange rates during transactions abroad.",triggered,Payment Processing System,2024-03-08T06:12:12Z,2024-03-08T06:12:12Z,
246,Q2FAWGYF2CXONQ,Enhanced Biometric Security,[#246] Enhanced Biometric Security,"To bolster security measures, the payment processing service implemented advanced biometric authentication options, such as fingerprint and facial recognition, ensuring secure and convenient transactions.",triggered,Payment Processing System,2024-03-08T06:13:00Z,2024-03-08T06:13:00Z,
247,Q1XMB5FEVDOBMF,Emerald Haven,[#247] Emerald Haven,: Transforming a Barren Lot into a Vibrant Oasis of Color and Serenity in Urban Landscapes,resolved,GreenThumb Landscapes,2024-03-08T06:13:03Z,2024-03-08T06:13:10Z,
248,Q17XCQ2ZZ1QCS6,Enchanted Forest,[#248] Enchanted Forest,Crafting a Magical Woodland Retreat Through Thoughtful Landscape Design and Sustainable Practices.,resolved,GreenThumb Landscapes,2024-03-08T06:13:35Z,2024-03-08T06:13:42Z,
249,Q3DPGDDRKQUEIL,Retail Partnership Rewards,[#249] Retail Partnership Rewards,"Collaborating with major retailers, the payment processing service offered exclusive discounts and promotions for users who made purchases using their platform, creating a win-win scenario for both customers and businesses.",triggered,Payment Processing System,2024-03-08T06:13:57Z,2024-03-08T06:13:57Z,
250,Q1U1ZIK8DY7GH4,Blossoming Tranquility,[#250] Blossoming Tranquility,"Cultivating Zen Gardens and Meditation Spaces, Inviting Peace and Harmony into Everyday Life.",resolved,GreenThumb Landscapes,2024-03-08T06:14:04Z,2024-03-08T06:14:13Z,
251,Q1VR2LZVSTW217,Referral Program Success,[#251] Referral Program Success,"A successful referral program led to a significant increase in new users, with existing customers earning rewards for introducing friends and family to the benefits of the payment processing service.",triggered,Payment Processing System,2024-03-08T06:14:37Z,2024-03-08T06:14:37Z,
252,Q3SZE3RGRS68CV,Voice-Activated Transactions,[#252] Voice-Activated Transactions,"The service introduced voice-activated transactions, allowing users to make payments and check balances using voice commands, showcasing a commitment to cutting-edge technology.",triggered,Payment Processing System,2024-03-08T06:15:27Z,2024-03-08T06:15:27Z,
253,Q2K8USPUA2XBNR,Digital Wallet Integration,[#253] Digital Wallet Integration,"Seamless integration with popular digital wallets increased the versatility of the payment processing service, allowing users to choose their preferred method of payment for added convenience.",triggered,Payment Processing System,2024-03-08T06:16:22Z,2024-03-08T06:16:22Z,
254,Q3ZNA3YT0FCQGC,Educational Financial Game,[#254] Educational Financial Game,The payment processing service launched an engaging mobile game aimed at educating younger users about financial responsibility and the basics of managing digital transactions.,triggered,Payment Processing System,2024-03-08T06:17:15Z,2024-03-08T06:17:15Z,
255,Q1FDDK974Z06KW,Seasonal Spending Analysis,[#255] Seasonal Spending Analysis,"The payment processing service introduced a feature that provided users with detailed analyses of their seasonal spending patterns, helping them make informed financial decisions during specific times of the year.",triggered,Payment Processing System,2024-03-08T06:18:39Z,2024-03-08T06:18:39Z,
256,Q271IQ9MVJ0WD1,Real-time Fraud Prevention,[#256] Real-time Fraud Prevention,"A real-time fraud prevention algorithm implemented by the payment processing service identified and blocked suspicious transactions, ensuring the security of user accounts and preventing potential financial losses.",triggered,Payment Processing System,2024-03-08T06:19:28Z,2024-03-08T06:19:28Z,
257,Q262L551NPUGJS,Sustainable Splendor,[#257] Sustainable Splendor,"Nurturing Native Flora and Eco-Friendly Landscapes, Redefining Beauty with Environmental Stewardship.",resolved,GreenThumb Landscapes,2024-03-08T06:19:59Z,2024-03-08T06:20:10Z,
258,Q1YRBLAZM2NUEU,Blockchain Integration,[#258] Blockchain Integration,"The service embraced blockchain technology to enhance transparency and security in transactions, gaining positive feedback for its commitment to staying at the forefront of financial innovation.",triggered,Payment Processing System,2024-03-08T06:20:04Z,2024-03-08T06:20:04Z,
259,Q0IARE36YB6RYL,Urban Eden,[#259] Urban Eden,"Reviving Concrete Jungles with Rooftop Gardens and Vertical Greenery, Bridging Nature and City Life.",resolved,GreenThumb Landscapes,2024-03-08T06:20:34Z,2024-03-08T06:20:41Z,
260,Q3UGWGU0NRJO34,Social Media Payment Sharing,[#260] Social Media Payment Sharing,"Users celebrated the introduction of a social media payment sharing feature, allowing them to easily split bills and share payments directly through popular social platforms",triggered,Payment Processing System,2024-03-08T06:20:35Z,2024-03-08T06:20:35Z,
261,Q1V30A9OSZCAZO,"""Harvesting Harmony","[#261] ""Harvesting Harmony",": Designing Edible Landscapes and Sustainable Food Gardens, Cultivating Health and Connection to the Earth.",resolved,GreenThumb Landscapes,2024-03-08T06:21:08Z,2024-03-08T06:21:15Z,
262,Q1P2T6TTVTVQ2M,Smart Contracts for Businesses,[#262] Smart Contracts for Businesses,"The payment processing service introduced smart contract functionality for businesses, streamlining and automating complex payment agreements, leading to increased efficiency in commercial transactions.",triggered,Payment Processing System,2024-03-08T06:21:13Z,2024-03-08T06:21:13Z,
263,Q2TLB40ZKDB6QB,Tranquil Waterscapes,[#263] Tranquil Waterscapes,"Crafting Serene Ponds, Streams, and Water Features, Bringing the Soothing Essence of Water to Outdoor Spaces",resolved,GreenThumb Landscapes,2024-03-08T06:21:46Z,2024-03-08T06:21:56Z,
264,Q3RYYAGWLSXA41,Contactless Charity Donations,[#264] Contactless Charity Donations,"The service partnered with charitable organizations to enable contactless donations, making it easier for users to contribute to causes they care about with a simple tap of their devices.",triggered,Payment Processing System,2024-03-08T06:21:50Z,2024-03-08T06:21:50Z,
265,Q0CLMPSUEPWT58,Cryptocurrency Cashback Rewards,[#265] Cryptocurrency Cashback Rewards,"Users who engaged in transactions using cryptocurrency were rewarded with additional cashback incentives, encouraging the adoption of digital currencies for everyday purchases.",triggered,Payment Processing System,2024-03-08T06:22:34Z,2024-03-08T06:22:34Z,
266,Q33JJFK3FLUN8T,Seasonal Spectacle,[#266] Seasonal Spectacle,"Creating Dynamic Gardens that Bloom Year-Round, Infusing Landscapes with Ever-Evolving Beauty and Charm",resolved,GreenThumb Landscapes,2024-03-08T06:22:39Z,2024-03-08T06:22:47Z,
267,Q3H966WZ1XJ83Z,Personalized Financial Insights,[#267] Personalized Financial Insights,"The payment processing service launched an AI-driven feature that provided users with personalized financial insights, helping them identify areas for potential savings and financial improvement.",triggered,Payment Processing System,2024-03-08T06:23:06Z,2024-03-08T06:23:06Z,
268,Q1XH95MXAPQ3IC,Pollinator Paradise,[#268] Pollinator Paradise,"Establishing Gardens that Welcome Bees, Butterflies, and Birds, Preserving Biodiversity and Ecosystem Health",resolved,GreenThumb Landscapes,2024-03-08T06:23:10Z,2024-03-08T06:23:17Z,
269,Q3XLO6EXLTP9CM,Transaction Round-Up Charity Program,[#269] Transaction Round-Up Charity Program,"Users could opt to round up their transactions to the nearest dollar, with the spare change automatically donated to a selected charity, fostering a sense of social responsibility.",triggered,Payment Processing System,2024-03-08T06:23:39Z,2024-03-08T06:23:39Z,
270,Q0HB2OSAT58P1H,Rural Revival,[#270] Rural Revival," Transforming Farmsteads and Countryside Estates into Picturesque Retreats, Embracing the Charm of Rural Life.",resolved,GreenThumb Landscapes,2024-03-08T06:23:41Z,2024-03-08T06:23:59Z,
272,Q2CC3O4YC5NDIW,Emergency Fund Auto-Savings,[#272] Emergency Fund Auto-Savings,"A new feature allowed users to set up automatic transfers to an emergency fund every time they made a transaction, promoting a proactive approach to financial preparedness.",triggered,Payment Processing System,2024-03-08T06:24:35Z,2024-03-08T06:24:35Z,
273,Q1125ZFGGA84LA,"""Zen Retreats","[#273] ""Zen Retreats","Designing Japanese Gardens and Tranquil Courtyards, Inviting Balance and Harmony into Outdoor Spaces.",resolved,GreenThumb Landscapes,2024-03-08T06:24:36Z,2024-03-08T06:24:44Z,
274,Q23L6DEQKIOVDJ,Healing Gardens,[#274] Healing Gardens,"Creating Therapeutic Spaces that Soothe the Mind, Body, and Spirit, Harnessing Nature's Restorative Power.",resolved,GreenThumb Landscapes,2024-03-08T06:25:06Z,2024-03-08T06:25:14Z,
275,Q0DMGDQXJIAG3X,Coastal Haven,[#275] Coastal Haven," Transforming Seaside Properties into Coastal Retreats, Blending Coastal Flora with Elegant Design.",resolved,GreenThumb Landscapes,2024-03-08T06:25:40Z,2024-03-08T06:25:48Z,
276,Q153UHJZJ95GWJ,Arboreal Symphony,[#276] Arboreal Symphony," Cultivating Forest Gardens and Arboretums, Preserving Tree Diversity and Honoring the Majesty of Woodlands.",resolved,GreenThumb Landscapes,2024-03-08T06:26:16Z,2024-03-08T06:26:35Z,
278,Q16AR93A00MR35,Minimalist Oasis,[#278] Minimalist Oasis," Designing Sleek and Stylish Landscapes with Clean Lines and Zen Aesthetics, Creating Urban Retreats.",resolved,GreenThumb Landscapes,2024-03-08T06:26:57Z,2024-03-08T06:27:04Z,
279,Q3YZYO1K45TKI7,Innovative Green Roofs,[#279] Innovative Green Roofs," Engineering Sustainable Rooftop Gardens and Green Spaces, Redefining Urban Living and Biodiversity.",resolved,GreenThumb Landscapes,2024-03-08T06:27:29Z,2024-03-08T06:27:37Z,
280,Q1H0WXMXC1G6Z9,Secret Garden Escapes,[#280] Secret Garden Escapes,"Crafting Hidden Retreats and Secluded Sanctuaries, Inviting Exploration and Discovery",resolved,GreenThumb Landscapes,2024-03-08T06:27:59Z,2024-03-08T06:28:13Z,
282,Q1GPFH382I1MNJ,Cultural Landscapes,[#282] Cultural Landscapes," Designing Gardens Inspired by Global Traditions and Indigenous Wisdom, Celebrating Diversity and Connection.",resolved,GreenThumb Landscapes,2024-03-08T06:28:37Z,2024-03-08T06:28:50Z,
284,Q0RNVHPKWQ2AM1,Alpine Hideaways,[#284] Alpine Hideaways," Creating Mountain Retreats and Alpine Gardens, Embracing the Majesty of High Altitude Landscapes",resolved,GreenThumb Landscapes,2024-03-08T06:29:10Z,2024-03-08T06:29:20Z,
285,Q1O29OEEVLCY1I,Rooftop Farming Revolution,[#285] Rooftop Farming Revolution,"Establishing Urban Farms and Green Spaces Atop Skyscrapers, Nourishing Communities and Promoting Sustainability.",resolved,GreenThumb Landscapes,2024-03-08T06:29:48Z,2024-03-08T06:29:56Z,
287,Q2I4FEDGQZ5NFY,Historic Gardens Restored,[#287] Historic Gardens Restored,"Preserving Heritage Landscapes and Revitalizing Historic Estates, Honoring the Legacy of the Past",resolved,GreenThumb Landscapes,2024-03-08T06:30:25Z,2024-03-08T06:30:34Z,
289,Q30JW4ZFVRZ2BJ,Mediterranean Retreats,[#289] Mediterranean Retreats," Crafting Sun-Drenched Gardens and Coastal Paradises, Embracing the Essence of Mediterranean Living",resolved,GreenThumb Landscapes,2024-03-08T06:31:01Z,2024-03-08T06:31:08Z,
290,Q14X0A5511198U,Biometric Payment Events,[#290] Biometric Payment Events,"The payment processing service hosted events in major cities where users could experience exclusive biometric payment options, promoting the convenience and security of futuristic transaction methods.",triggered,Payment Processing System,2024-03-08T06:31:17Z,2024-03-08T06:31:17Z,
292,Q1QK808IL4Z7UP,Eco-Friendly Urbanism,[#292] Eco-Friendly Urbanism," Designing Sustainable Parks and Green Spaces, Enhancing Urban Livability and Environmental Resilience.",resolved,GreenThumb Landscapes,2024-03-08T06:31:43Z,2024-03-08T06:31:49Z,
294,Q2TG947T2PCY9Y,Tropical Oasis,[#294] Tropical Oasis,"Cultivating Exotic Gardens and Tropical Paradises, Infusing Landscapes with the Vibrant Spirit of the Tropics",resolved,GreenThumb Landscapes,2024-03-08T06:32:11Z,2024-03-08T06:32:18Z,
295,Q380CX81P2R2FN,Cryptocurrency Cashback Weekend,[#295] Cryptocurrency Cashback Weekend,"To encourage cryptocurrency usage, the service launched a special promotion where users received double cashback rewards for all transactions made with digital currencies during a designated weekend.",resolved,Payment Processing System,2024-03-08T06:32:11Z,2024-03-22T08:21:29Z,
296,Q27GXYB0YXK5R7,Personalized Spending Challenges,[#296] Personalized Spending Challenges,"Users were invited to participate in personalized spending challenges tailored to their financial goals, promoting responsible spending habits and financial awareness.",triggered,Payment Processing System,2024-03-08T06:32:50Z,2024-03-08T06:32:50Z,
297,Q04VL7ACOLHUIC,Sensory Gardens,[#297] Sensory Gardens,"Designing Landscapes that Stimulate the Senses, Inviting Exploration and Delight for All Ages",resolved,GreenThumb Landscapes,2024-03-08T06:32:50Z,2024-03-08T06:32:59Z,
298,Q3YXQ3YYJCR23P,Wellness Retreats,[#298] Wellness Retreats,"Creating Healing Environments and Therapeutic Gardens, Nurturing Mind, Body, and Soul",resolved,GreenThumb Landscapes,2024-03-08T06:33:31Z,2024-03-08T06:33:41Z,
300,Q1EHRR6EM3RC5I,Cottage Garden Charm,[#300] Cottage Garden Charm,"Reviving Traditional Cottage Gardens and Country Landscapes, Evoking Nostalgia and Timeless Beauty.",resolved,GreenThumb Landscapes,2024-03-08T06:34:04Z,2024-03-08T06:34:13Z,
301,Q0IAA2GMHD2ZFB,Eco-Friendly Playgrounds,[#301] Eco-Friendly Playgrounds,"Designing Sustainable Play Spaces and Natural Playgrounds, Inspiring Creative Exploration and Environmental Awareness.",resolved,GreenThumb Landscapes,2024-03-08T06:34:40Z,2024-03-08T06:34:51Z,
302,Q2ALR4C9PVNRKP,Riverside Sanctuaries,[#302] Riverside Sanctuaries,": Crafting Tranquil Gardens and Waterside Retreats, Harnessing the Calming Influence of Rivers and Streams",resolved,GreenThumb Landscapes,2024-03-08T06:35:15Z,2024-03-08T06:35:23Z,
304,Q058Z4Q6I57POF,Sculpted Symmetry,[#304] Sculpted Symmetry,"Creating Formal Gardens and Manicured Landscapes, Achieving Timeless Elegance and Architectural Harmony.",resolved,GreenThumb Landscapes,2024-03-08T06:35:44Z,2024-03-08T06:36:01Z,
306,Q20CKWTEOSVZ4B,Zero-Fee International Transfers,[#306] Zero-Fee International Transfers,"The payment processing service celebrated a milestone by temporarily waiving fees for international money transfers, making cross-border transactions more affordable for users.",triggered,Payment Processing System,2024-03-08T06:35:58Z,2024-03-08T06:35:58Z,
307,Q2Y1ZTNRZID9TV,Wildflower Meadows,[#307] Wildflower Meadows,"Cultivating Naturalistic Landscapes and Prairie Gardens, Celebrating Native Flora and Wildlife Habitat.",resolved,GreenThumb Landscapes,2024-03-08T06:36:28Z,2024-03-08T06:36:34Z,
310,Q1989744IHISB3,Sustainable Campus Initiatives,[#310] Sustainable Campus Initiatives,"Designing Green Spaces and Educational Gardens, Fostering Environmental Awareness and Stewardship",resolved,GreenThumb Landscapes,2024-03-08T06:37:16Z,2024-03-08T06:37:25Z,
312,Q1K1BLRBF5L36R,Instant Merchant Payouts,[#312] Instant Merchant Payouts,"A new feature allowed merchants to receive payments instantly, improving cash flow for businesses and gaining positive feedback from the entrepreneurial community.",triggered,Payment Processing System,2024-03-08T06:37:33Z,2024-03-08T06:37:33Z,
313,Q0EFJE6EQ1FY2Y,Zen Courtyards,[#313] Zen Courtyards," Crafting Tranquil Retreats and Serene Outdoor Spaces, Balancing Minimalism with Natural Beauty.""",resolved,GreenThumb Landscapes,2024-03-08T06:37:48Z,2024-03-08T06:37:55Z,
314,Q0NY0ZE49582G9,Community Crowdfunding Platform,[#314] Community Crowdfunding Platform,"The payment processing service introduced a crowdfunding platform, enabling users to support community projects and initiatives directly through the platform.",resolved,Payment Processing System,2024-03-08T06:38:30Z,2024-03-22T08:46:15Z,
315,Q0U47JNO7XC870,Permaculture Paradigm,[#315] Permaculture Paradigm,"Implementing Permaculture Principles in Landscape Design, Creating Regenerative and Self-Sustaining Ecosystems.",resolved,GreenThumb Landscapes,2024-03-08T06:38:35Z,2024-03-08T06:38:42Z,
317,Q2AAE0HA9AJQ8L,Urban Biodiversity Corridors,[#317] Urban Biodiversity Corridors,"Establishing Greenways and Wildlife Habitats in Urban Areas, Promoting Ecological Connectivity and Resilience.",resolved,GreenThumb Landscapes,2024-03-08T06:39:05Z,2024-03-08T06:39:12Z,
319,Q02VIWKUASD6TZ,Native Plant Sanctuaries,[#319] Native Plant Sanctuaries,"Preserving Indigenous Flora and Habitat, Restoring Ecological Balance and Supporting Local Wildlife.""",resolved,GreenThumb Landscapes,2024-03-08T06:39:33Z,2024-03-08T06:39:40Z,
320,Q1A1CSO5CQRE6W,Subscription Pause Option,[#320] Subscription Pause Option,"Users appreciated a feature that allowed them to temporarily pause their subscription payments during times of financial strain, showcasing the service's commitment to user-centric solutions.",triggered,Payment Processing System,2024-03-08T06:39:35Z,2024-03-08T06:39:35Z,
321,Q0X80BBOS4PQ9V,Edutainment Gardens,[#321] Edutainment Gardens,"Designing Interactive and Educational Landscapes, Engaging Visitors in Hands-On Learning and Discovery.",resolved,GreenThumb Landscapes,2024-03-08T06:40:01Z,2024-03-08T06:40:08Z,
322,Q32FBDHQOWL3R4,Eco-Friendly Transaction Initiative,[#322] Eco-Friendly Transaction Initiative,"The service pledged to plant a tree for every transaction made during a specified period, promoting environmental awareness and sustainable business practices.",triggered,Payment Processing System,2024-03-08T06:40:14Z,2024-03-08T06:40:14Z,
323,Q07OBBBVWBB8WO,Solar-Powered Landscapes,[#323] Solar-Powered Landscapes,"Integrating Renewable Energy Solutions into Outdoor Spaces, Promoting Sustainability and Energy Efficiency",resolved,GreenThumb Landscapes,2024-03-08T06:40:44Z,2024-03-08T06:40:52Z,
324,Q1UGXT232P0AC0,Automated Savings Jar,[#324] Automated Savings Jar,"Users could set up automated savings jars for specific financial goals, such as vacations or major purchases, with the payment processing service seamlessly diverting funds toward these goals.",triggered,Payment Processing System,2024-03-08T06:40:56Z,2024-03-08T06:40:56Z,
326,Q0Y7JUCH45AJAU,"""Green Infrastructure Revolution","[#326] ""Green Infrastructure Revolution","Implementing Sustainable Stormwater Management and Urban Resilience Strategies, Creating Climate-Resilient Communities.",resolved,GreenThumb Landscapes,2024-03-08T06:41:17Z,2024-03-08T06:41:30Z,
328,Q3TWFYCBO3TS1P,Digital Invoicing for Small Businesses,[#328] Digital Invoicing for Small Businesses,"Small businesses benefited from a streamlined digital invoicing system provided by the payment processing service, reducing administrative burdens and improving overall efficiency.",triggered,Payment Processing System,2024-03-08T06:41:42Z,2024-03-08T06:41:42Z,
329,Q2OO0RUDIMNJKW,Organic Orchards,[#329] Organic Orchards,"Cultivating Fruit and Nut Trees in Sustainable Orchards, Fostering Local Food Systems and Agricultural Diversity.",resolved,GreenThumb Landscapes,2024-03-08T06:41:55Z,2024-03-08T06:42:04Z,
332,Q3I2QQ8749M460,Artisanal Landscapes,[#332] Artisanal Landscapes," Crafting Handcrafted Gardens and Artistic Outdoor Spaces, Infusing Landscapes with Unique Personalities.",resolved,GreenThumb Landscapes,2024-03-08T06:42:33Z,2024-03-08T06:42:42Z,
334,Q2K6YCVRO7P4FZ,Virtual Card Integration,[#334] Virtual Card Integration,"The payment processing service introduced virtual cards that users could generate instantly for online transactions, adding an extra layer of security and convenience.",triggered,Payment Processing System,2024-03-08T06:43:10Z,2024-03-08T06:43:10Z,
335,Q0909GVLORWFG0,Therapeutic Horticulture,[#335] Therapeutic Horticulture,"Integrating Plant-Based Healing Practices into Landscape Design, Promoting Mental and Emotional Wellness",resolved,GreenThumb Landscapes,2024-03-08T06:43:12Z,2024-03-08T06:43:22Z,
336,Q25VHH36H7RFND,Alleviating Urban Heat Islands,[#336] Alleviating Urban Heat Islands," Implementing Green Roof and Urban Canopy Solutions, Mitigating Heat and Improving Air Quality.",resolved,GreenThumb Landscapes,2024-03-08T06:43:56Z,2024-03-08T06:44:05Z,
337,Q04HF85C4PKYO6,Healthcare Expense Tracking,[#337] Healthcare Expense Tracking,"Recognizing the rising importance of healthcare expenses, the service implemented a feature that allowed users to categorize and track medical expenditures for better financial planning.",triggered,Payment Processing System,2024-03-08T06:44:09Z,2024-03-08T06:44:09Z,
